{
  "$schema": "https://json-schema.org/draft/2020-12/schema",
  "title": "Pregnancy Parenting Knowledge Card",
  "type": "object",
  "required": [
    "id",
    "title",
    "domain",
    "stage",
    "category",
    "summary",
    "actions",
    "avoid",
    "askDoctorWhen",
    "redFlags",
    "shoppingType",
    "fatherTasks",
    "sources",
    "evidenceLevel",
    "reviewStatus",
    "updatedAt"
  ],
  "properties": {
    "id": { "type": "string" },
    "title": { "type": "string" },
    "domain": { "type": "string" },
    "stage": { "type": "string" },
    "category": { "type": "string" },
    "summary": { "type": "string" },
    "actions": { "type": "array", "items": { "type": "string" } },
    "avoid": { "type": "array", "items": { "type": "string" } },
    "askDoctorWhen": { "type": "array", "items": { "type": "string" } },
    "redFlags": { "type": "array", "items": { "type": "string" } },
    "shoppingType": { "type": "string" },
    "fatherTasks": { "type": "array", "items": { "type": "string" } },
    "sources": { "type": "array", "items": { "type": "string" } },
    "evidenceLevel": { "type": "string" },
    "reviewStatus": { "type": "string" },
    "updatedAt": { "type": "string", "pattern": "^\\d{4}-\\d{2}-\\d{2}$" }
  },
  "additionalProperties": false
}
