{
  "id": "medical-pregnancy-timeline-prenatal-care",
  "title": "孕期时间线和产检节点待审核草稿",
  "domain": "medical",
  "stage": "pregnancy-all",
  "category": "prenatal-checkup",
  "summary": "孕期保健应从确定妊娠后尽早开始，围绕孕早期、孕中期和孕晚期逐步完成建册、产前检查、危险因素筛查、营养和心理卫生指导、胎儿发育相关筛查以及分娩前准备。国家孕产期保健规范提出整个妊娠期间至少 5 次产前检查：孕早期至少 1 次，孕中期至少 2 次，孕晚期至少 2 次，其中至少 1 次在孕 36 周后；发现异常时应由医生评估是否增加检查次数。",
  "actions": [
    "确认妊娠后尽早到医疗保健机构建孕产期保健册，记录末次月经、既往病史、妊娠分娩史、用药、过敏和家族遗传病史。",
    "孕早期（妊娠 12+6 周前）至少安排 1 次产检，重点是确定妊娠和孕周、完成初诊问诊和基础检查、筛查危险因素。",
    "孕中期（妊娠 13-27+6 周）至少安排 2 次产检，可按医生安排关注孕 16-20 周、孕 21-24 周等窗口，完成相应时期的胎儿发育筛查和孕期保健指导。",
    "孕晚期（妊娠 28 周及以后）至少安排 2 次产检，其中至少 1 次在孕 36 周后，重点关注胎动自我监测、胎儿生长、分娩方式评估、分娩机构选择和住院分娩准备。",
    "每次产检后把下一次检查时间、检查前准备、复查项目和医生明确交代的危险信号写入家庭日历或产检记录。"
  ],
  "avoid": [
    "不要把“至少 5 次产前检查”理解为所有孕妇只需要 5 次；有异常、合并症、并发症或高危因素时，应按医生安排增加检查和随访。",
    "不要因为没有明显不适就推迟建册、跳过初诊或漏做医生安排的复诊。",
    "不要把不同医院、不同地区的具体预约流程和检查项目当作全国统一时间表。",
    "不要自行判读产检报告、胎儿筛查结果或是否需要转诊。"
  ],
  "askDoctorWhen": [
    "出现腹痛、阴道出血、发热、持续呕吐不能进食、明显头痛或视物异常、胎动明显减少或明显异常时，应及时联系产检医生或就医。",
    "检查结果异常、医生提示高危因素、需要会诊或转诊、对下一次检查时间或准备事项不清楚时，应向产检机构确认。",
    "既往有慢性病、既往不良妊娠结局、正在用药或出现新的身体不适时，应在产检时主动告知医生。"
  ],
  "redFlags": [
    "腹痛",
    "阴道出血",
    "发热",
    "持续呕吐不能进食",
    "明显头痛或视物异常",
    "胎动明显减少或明显异常"
  ],
  "shoppingType": "not-applicable",
  "fatherTasks": [],
  "sources": [
    "nhc-prenatal-care-2011",
    "who-antenatal-care-2016"
  ],
  "evidenceLevel": "guideline",
  "reviewStatus": "reviewed",
  "updatedAt": "2026-05-08"
}
