{
  "id": "medical-pregnancy-early-care-notes",
  "title": "孕早期注意事项待审核草稿",
  "domain": "medical",
  "stage": "pregnancy-early",
  "category": "prenatal-checkup",
  "summary": "孕早期保健重点包括尽早确认妊娠、建立孕产期保健册、完成初诊问诊和检查，并接受营养、心理、卫生、避免致畸因素和疾病预防等指导。本卡为待审核草稿，不替代产检医生判断。",
  "actions": [
    "确认妊娠后尽早联系医疗保健机构，按当地要求建立孕产期保健册或卡。",
    "首次产检时如实告知既往史、月经史、妊娠分娩史、家族史、用药和生活方式等信息。",
    "按医生安排完成孕早期问诊、体格检查、产科检查和必要辅助检查。",
    "把医生提供的营养、心理、卫生、口腔卫生、避免致畸因素和疾病预防指导记录下来。"
  ],
  "avoid": [
    "不要自行删减医生安排的初诊检查或复查。",
    "不要隐瞒既往疾病、用药、出血、腹痛等信息。",
    "不要基于网络经验自行判断检查结果或调整用药。"
  ],
  "askDoctorWhen": [
    "出现腹痛、阴道出血、发热、持续呕吐不能进食、明显头痛或视物异常时，及时咨询医生或就医。",
    "对检查项目、复查时间、营养补充、用药或是否需要专科会诊不确定时，向产检医生确认。"
  ],
  "redFlags": [
    "腹痛",
    "阴道出血",
    "发热",
    "持续呕吐不能进食",
    "明显头痛或视物异常"
  ],
  "shoppingType": "not-applicable",
  "fatherTasks": [],
  "sources": [
    "nhc-prenatal-care-2011",
    "who-antenatal-care-2016"
  ],
  "evidenceLevel": "guideline",
  "reviewStatus": "needs-review",
  "updatedAt": "2026-05-08"
}
