{
  "id": "medical-pregnancy-early-body-status",
  "title": "孕早期身体状态观察待审核草稿",
  "domain": "medical",
  "stage": "pregnancy-early",
  "category": "prenatal-checkup",
  "summary": "孕早期指妊娠12+6周前，身体状态观察重点是确认妊娠和孕周、建立孕产期保健记录、完成初诊问诊与基础检查，并筛查危险因素。早孕反应、腹痛、出血、发热或持续呕吐等情况不能自行判断是否正常，应由产检医生结合检查结果评估。",
  "actions": [
    "记录末次月经、既往疾病、既往妊娠分娩史、用药、过敏、家族史和生活方式等信息，首次产检时如实告知。",
    "记录腹痛、阴道出血、发热、呕吐、头痛、视物异常等身体变化，注明出现时间、持续时间和是否加重。",
    "按医生安排完成身高、体重、血压、全身体格检查、孕早期盆腔检查和必要辅助检查。",
    "保存血常规、血型、尿常规、阴道分泌物、肝肾功能、乙肝、梅毒、艾滋病等检查结果，复诊时带齐。",
    "如果医生提示危险因素或高危管理，确认随访频率、复查项目、转诊地点和紧急联系方式。"
  ],
  "avoid": [
    "不要把身体不适自行归因于正常早孕反应而延误咨询。",
    "不要自行判读化验单是否正常。",
    "不要因为没有明显不适就跳过建册或初诊检查。",
    "不要隐瞒既往疾病、用药、出血、腹痛或感染筛查相关信息。"
  ],
  "askDoctorWhen": [
    "腹痛、阴道出血、发热、持续呕吐不能进食、明显头痛或视物异常出现时，及时咨询医生或就医。",
    "检查结果异常、医生提示高危因素、需要会诊或转诊时，按医生要求复诊或转诊。"
  ],
  "redFlags": [
    "腹痛",
    "阴道出血",
    "发热",
    "持续呕吐不能进食",
    "明显头痛或视物异常"
  ],
  "shoppingType": "not-applicable",
  "fatherTasks": [],
  "sources": [
    "nhc-prenatal-care-2011"
  ],
  "evidenceLevel": "guideline",
  "reviewStatus": "reviewed",
  "updatedAt": "2026-05-08"
}
