{
  "id": "medical-pregnancy-late-diet-structure",
  "title": "孕晚期膳食结构待审核草稿",
  "domain": "medical",
  "stage": "pregnancy-late",
  "category": "feeding",
  "summary": "孕晚期膳食结构仍以孕期妇女平衡膳食宝塔为基础，并在孕中晚期适量增加奶、鱼、禽、蛋、瘦肉摄入；同时关注体重适宜增长、含铁食物、碘盐、叶酸和维生素D补充边界，并为母乳喂养做准备。本卡为待审核草稿，不替代个体化营养评估。",
  "actions": [
    "继续按宝塔分层安排谷薯类、蔬菜、水果、鱼禽蛋肉、奶类、大豆坚果、油盐和水。",
    "在孕晚期重点核对奶、鱼、禽、蛋、瘦肉是否按专业建议适量增加。",
    "继续关注含铁丰富食物、碘盐，以及叶酸和维生素D补充的专业建议。",
    "结合产检评估体重增长、血压、血糖和贫血等情况；异常时转医生或营养专业人员处理。",
    "把分娩前饮食安排和母乳喂养准备作为产检咨询内容之一。"
  ],
  "avoid": [
    "不要把临产前饮食经验写成通用医学建议。",
    "不要自行处理血糖异常、贫血、妊娠期高血压或体重增长异常。",
    "不要把补充剂建议理解为自行加量或更换产品。",
    "不要把本卡当作具体食谱、营养素剂量或补充剂处方。"
  ],
  "askDoctorWhen": [
    "血糖异常、贫血、妊娠期高血压、体重增长异常、基础疾病或需要营养补充剂时，咨询医生或营养专业人员。",
    "对分娩前饮食、补充剂、用药或检查结果不确定时，向产检医生确认。"
  ],
  "redFlags": [
    "血糖异常",
    "贫血",
    "妊娠期高血压",
    "体重增长异常",
    "基础疾病"
  ],
  "shoppingType": "not-applicable",
  "fatherTasks": [],
  "sources": [
    "cns-pregnant-lactating-dietary-guidelines-2022",
    "who-antenatal-care-2016"
  ],
  "evidenceLevel": "guideline",
  "reviewStatus": "needs-review",
  "updatedAt": "2026-05-08"
}
