{
  "id": "early-education-toddler-1-2-reading-language-interaction",
  "title": "1-2 岁亲子阅读和语言互动",
  "domain": "early-education",
  "stage": "toddler-1-3y",
  "category": "language-reading",
  "summary": "1-2 岁亲子阅读和语言互动的重点是稳定、回应式的日常交流：每天读一会儿书，围绕孩子看见、指向或说出的内容回应和扩展，配合命名身体部位、熟悉物品、简单指令和共同探索。它不是识字训练，也不应用单词数量或背诵表现评价孩子。",
  "actions": [
    "每天安排短而稳定的共读时间，可以由孩子翻页、指图，照护者用简单句说出图中人物、物品和动作。",
    "当孩子说出不完整词语时，先肯定其表达，再自然扩展成完整词句，例如把孩子的单词扩成一句日常描述。",
    "在穿衣、吃饭、收玩具和外出时命名身体部位、熟悉物品和动作，让语言互动嵌入真实生活。",
    "用找一找、指一指、配对、简单拼图等活动支持孩子识别常见物品和尝试新事物。",
    "孩子愿意自己吃饭、穿脱简单衣物或拿取物品时，给足够时间尝试，并用具体语言描述他正在做的事。"
  ],
  "avoid": [
    "不要把 1-2 岁共读变成识字、背诵、刷题或长时间坐定训练。",
    "不要用孩子说了多少词、会不会背书、是否认识字母或汉字来判断孩子好坏。",
    "不要在孩子拒绝阅读、疲劳或烦躁时强迫完成固定页数。",
    "不要用屏幕替代日常对话和亲子共读；18 个月以下除视频通话外应避免屏幕媒体，较大幼儿也应由家庭制定限制。",
    "不要忽视安全看护，尤其是孩子在水边、楼梯、道路或攀爬环境中探索时。"
  ],
  "askDoctorWhen": [
    "如果照护者持续担心孩子听力、语言理解、发声、眼神交流、互动反应或发育进展，应咨询儿科医生或儿童保健机构。",
    "如果孩子出现明显退化，例如原本会的词语、互动或动作能力减少，应尽快咨询专业人员。",
    "如果孩子有吞咽、进食、呼吸异常、反复呛咳或其他安全风险，应及时就医。"
  ],
  "redFlags": [
    "照护者怀疑听力异常",
    "语言或互动能力明显退化",
    "对声音、呼名或日常互动反应持续异常",
    "进食时反复呛咳或呼吸异常"
  ],
  "shoppingType": "not-applicable",
  "fatherTasks": [],
  "sources": [
    "cdc-positive-parenting-toddlers-1-2"
  ],
  "evidenceLevel": "public-health-guidance",
  "reviewStatus": "needs-review",
  "updatedAt": "2026-05-08"
}
