{
  "id": "medical-pregnancy-late-diet-structure",
  "title": "孕晚期膳食结构待审核草稿",
  "domain": "medical",
  "stage": "pregnancy-late",
  "category": "feeding",
  "summary": "孕晚期膳食结构仍以孕期妇女平衡膳食宝塔为基础。来源图给出的每日参考量包括：谷类225-275克、薯类75克、蔬菜400-500克、水果200-350克、鱼禽蛋肉175-225克、奶类300-500克、大豆/坚果20克/10克、油25克、加碘食盐5克、水1700毫升。本卡为待审核草稿，不替代个体化营养评估。",
  "actions": [
    "每日膳食按孕晚期参考量核对：谷类225-275克，其中全谷物和杂豆75-125克；薯类75克；蔬菜类400-500克；水果类200-350克。",
    "每日继续核对：鱼禽蛋肉类175-225克，其中畜禽肉50-75克、鱼虾75-100克、蛋类50克；奶类300-500克；大豆/坚果20克/10克；油25克；加碘食盐5克；水1700毫升。",
    "继续关注含铁丰富食物、碘盐，以及叶酸和维生素D补充的专业建议。",
    "结合产检评估体重增长、血压、血糖和贫血等情况；异常时转医生或营养专业人员处理。",
    "把分娩前饮食安排和母乳喂养准备作为产检咨询内容之一。"
  ],
  "avoid": [
    "不要把临产前饮食经验写成通用医学建议。",
    "不要自行处理血糖异常、贫血、妊娠期高血压或体重增长异常。",
    "不要把补充剂建议理解为自行加量或更换产品。",
    "不要把本卡当作具体食谱、营养素剂量或补充剂处方。"
  ],
  "askDoctorWhen": [
    "血糖异常、贫血、妊娠期高血压、体重增长异常、基础疾病或需要营养补充剂时，咨询医生或营养专业人员。",
    "对分娩前饮食、补充剂、用药或检查结果不确定时，向产检医生确认。"
  ],
  "redFlags": [
    "血糖异常",
    "贫血",
    "妊娠期高血压",
    "体重增长异常",
    "基础疾病"
  ],
  "shoppingType": "not-applicable",
  "fatherTasks": [],
  "sources": [
    "cns-pregnant-lactating-dietary-guidelines-2022",
    "who-antenatal-care-2016"
  ],
  "evidenceLevel": "guideline",
  "reviewStatus": "reviewed",
  "updatedAt": "2026-05-08"
}
