{
  "id": "father-tasks-prenatal-visit-checkup-support",
  "title": "孕检时爸爸注意事项待审核草稿",
  "domain": "father-tasks",
  "stage": "pregnancy-all",
  "category": "father-prenatal",
  "summary": "孕检时爸爸的任务不是替妈妈做医学判断，而是做好交通和资料准备、帮助记录症状和问题、在现场尊重妈妈表达、把医生交代事项转成可执行的家庭安排，并在出现危险信号时协助及时联系医生或就医。",
  "actions": [
    "产检前一天核对预约时间、交通路线、证件、医保资料、孕产期保健册、既往检查报告和本次问题清单。",
    "和妈妈一起整理近期症状记录，尤其是腹痛、出血、发热、呕吐、头痛、视物异常、胎动变化，以及出现时间和是否加重。",
    "现场让妈妈优先表达自己的感受和问题；如果她遗漏了提前准备的事项，再补充提醒。",
    "记录医生明确说出的下一次复诊时间、检查前准备、复查项目、需要观察的异常信号和紧急联系方式。",
    "产检后把复诊预约、检查准备、报告领取、交通安排和家务分工写入共享日历或清单。",
    "如果孕晚期需要准备分娩机构路线、待产包或车辆安排，把这些后勤任务拆成具体日期和负责人。"
  ],
  "avoid": [
    "不要替妈妈隐瞒症状、替她回答不确定的病史，或把她的不适简单说成“正常”。",
    "不要自行解释化验单、超声结果、胎心监护结果，或自行决定是否用药、停药、复查和转诊。",
    "不要在产检现场抢话、否定妈妈的担心，或把医生建议只记成模糊的“注意休息”。",
    "不要只负责开车排队，产检后却不落实下一步检查、家庭分工和风险观察。"
  ],
  "askDoctorWhen": [
    "妈妈出现腹痛、阴道出血、发热、持续呕吐不能进食、明显头痛或视物异常、胎动明显减少或明显异常时，协助及时联系产检医生或就医。",
    "对检查结果、用药、复查时间、是否需要转诊或分娩机构选择不清楚时，陪同妈妈向医生确认。",
    "如果妈妈出现明显焦虑、持续失眠、无法照顾自己或有自伤念头，应协助尽快寻求产科医生、心理或精神卫生专业人员帮助。"
  ],
  "redFlags": [
    "腹痛",
    "阴道出血",
    "发热",
    "持续呕吐不能进食",
    "明显头痛或视物异常",
    "胎动明显减少或明显异常",
    "持续失眠或自伤念头"
  ],
  "shoppingType": "not-applicable",
  "fatherTasks": [
    "产检前核对预约、路线、证件、医保资料、孕产期保健册和既往检查报告。",
    "和妈妈一起写下本次问题清单和症状记录，现场补充但不替她表达。",
    "记录医生交代的复诊时间、检查准备、复查项目、危险信号和紧急联系方式。",
    "产检后把预约、报告领取、交通和家务分工落实到共享日历或清单。",
    "发现腹痛、出血、胎动明显异常、明显头痛视物异常等情况时，协助及时联系医生或就医。"
  ],
  "sources": [
    "nhc-prenatal-care-2011",
    "nhs-advice-for-partners-pregnancy",
    "tommys-getting-involved-pregnancy"
  ],
  "evidenceLevel": "public-health-guidance",
  "reviewStatus": "reviewed",
  "updatedAt": "2026-05-08"
}
