{
  "id": "family-records-prenatal-record-basics",
  "title": "产检记录的本地归档方式",
  "domain": "family-records",
  "stage": "pregnancy-all",
  "category": "records-prenatal",
  "summary": "家庭记录应以本地归档和复诊辅助为目标，不用于自动诊断。产检记录可按日期、孕周、医院、检查类型和医生建议整理。",
  "actions": [
    "为每次产检建立日期和孕周明确的记录。",
    "单独记录医生明确要求的复查时间、注意事项和需要带去复诊的问题。",
    "含个人信息的报告只放在 `family-records/`，不要放入公开资料目录。"
  ],
  "avoid": [
    "不要把家庭记录上传到公开目录。",
    "不要让本地问答基于检查报告做诊断。",
    "不要把医生医嘱改写成没有来源的通用医学建议。"
  ],
  "askDoctorWhen": [
    "检查报告出现异常标记、医生要求复查或身体出现不适时，应咨询医生。",
    "对医嘱理解不清时，应联系产检机构确认。"
  ],
  "redFlags": [
    "报告异常标记",
    "医生要求复查",
    "身体出现不适"
  ],
  "shoppingType": "not-applicable",
  "fatherTasks": [
    "协助扫描或拍照保存检查资料。",
    "把复查时间写入家庭日历。",
    "复诊前整理问题清单。"
  ],
  "sources": [
    "hospital-material-placeholder"
  ],
  "evidenceLevel": "local-material",
  "reviewStatus": "draft",
  "updatedAt": "2026-05-08"
}
