{
  "id": "father-tasks-pregnancy-early-support",
  "title": "孕早期爸爸任务清单",
  "domain": "father-tasks",
  "stage": "pregnancy-early",
  "category": "father-prenatal",
  "summary": "孕早期爸爸的重点是把建册和首次产检安排落地，同时针对孕早期常见不适做具体支持：协助识别恶心呕吐诱因、准备少量多餐和饮水、一起建立健康生活方式，并在症状影响生活或出现异常信号时推动及时咨询医生。",
  "actions": [
    "确认当地建册和首次产检流程，把证件、既往检查结果、末次月经或已确认孕周信息放入同一个资料袋。",
    "陪同或协助预约孕早期产检，现场记录医生说明的检查项目、复查时间、营养、心理和卫生指导。",
    "和孕妇一起核对健康生活方式：戒烟、避免二手烟、减少或停止饮酒，安排温和散步或医生允许的活动。",
    "观察并记录孕吐触发因素，例如特定气味、食物或时间段；准备少量多餐、饮水和容易入口的食物。",
    "一起了解预产期、产检节奏、可请假和经济安排，把下次产检、待问问题和需要携带的材料写入家庭日历。"
  ],
  "avoid": [
    "不要替孕妇解释检查结果、判断是否高危或决定是否继续检查。",
    "不要把严重或持续的孕吐、腹痛、出血等情况简单归为正常反应。",
    "不要自行建议止吐药、止痛药、保胎药或营养补充剂。",
    "不要继续在孕妇身边吸烟、饮酒后要求其照顾你，或把健康生活方式只当作孕妇一个人的事。"
  ],
  "askDoctorWhen": [
    "孕吐影响日常生活、持续不缓解、不能进食饮水，或出现腹痛、阴道出血、明显头痛、视物异常、发热时，及时联系医生或就医。",
    "对检查项目、复查时间、用药、营养补充、叶酸或维生素D等补充建议不确定时，向产检医生确认。"
  ],
  "redFlags": [
    "腹痛",
    "阴道出血",
    "明显头痛或视物异常",
    "发热",
    "持续呕吐不能进食或饮水"
  ],
  "shoppingType": "not-applicable",
  "fatherTasks": [
    "整理建册和首次产检资料袋。",
    "预约并陪同孕早期产检。",
    "记录医生交代的复查、营养、心理和卫生指导。",
    "协助记录孕吐触发因素并准备少量多餐和饮水。",
    "一起戒烟酒、安排温和活动并更新家庭日历。",
    "异常症状或孕吐影响生活时，协助联系医生或就医。"
  ],
  "sources": [
    "nhc-prenatal-care-2011",
    "nhs-advice-for-partners-pregnancy",
    "tommys-getting-involved-pregnancy"
  ],
  "evidenceLevel": "public-health-guidance",
  "reviewStatus": "reviewed",
  "updatedAt": "2026-05-08"
}
