{
  "id": "medical-pregnancy-middle-diet-structure",
  "title": "孕中期膳食结构待审核草稿",
  "domain": "medical",
  "stage": "pregnancy-middle",
  "category": "feeding",
  "summary": "孕中期膳食结构应继续遵循孕期妇女平衡膳食宝塔。来源图给出的每日参考量包括：谷类200-250克、薯类75克、蔬菜400-500克、水果200-300克、鱼禽蛋肉150-200克、奶类300-500克、大豆/坚果20克/10克、油25克、加碘食盐5克、水1700毫升。本卡为待审核草稿，不替代个体化营养评估。",
  "actions": [
    "每日膳食按孕中期参考量核对：谷类200-250克，其中全谷物和杂豆75-100克；薯类75克；蔬菜类400-500克；水果类200-300克。",
    "每日继续核对：鱼禽蛋肉类150-200克，其中畜禽肉50-75克、鱼虾50-75克、蛋类50克；奶类300-500克；大豆/坚果20克/10克；油25克；加碘食盐5克；水1700毫升。",
    "在孕中期关注含铁丰富食物、碘盐，以及叶酸和维生素D补充的专业建议。",
    "结合产检记录观察体重增长是否适宜；体重增长过快或过慢时，向医生或营养专业人员确认。",
    "在医生允许的前提下保持经常户外活动，并继续禁烟酒。"
  ],
  "avoid": [
    "不要把孕中期食量增加理解为只增加主食、甜食或高油食物。",
    "不要用商品、博主或个人经验替代权威膳食指南。",
    "不要自行处理贫血、血糖异常或体重增长异常。",
    "不要把本卡当作具体食谱、营养素剂量或补充剂处方。"
  ],
  "askDoctorWhen": [
    "贫血、血糖异常、体重增长异常、基础疾病或需要营养补充剂时，咨询医生或营养专业人员。",
    "对饮食调整、补充剂、用药或检查结果不确定时，向产检医生确认。"
  ],
  "redFlags": [
    "贫血",
    "血糖异常",
    "体重增长异常",
    "基础疾病"
  ],
  "shoppingType": "not-applicable",
  "fatherTasks": [],
  "sources": [
    "cns-pregnant-lactating-dietary-guidelines-2022",
    "who-antenatal-care-2016"
  ],
  "evidenceLevel": "guideline",
  "reviewStatus": "reviewed",
  "updatedAt": "2026-05-08"
}
