{
  "id": "medical-pregnancy-late-body-status",
  "title": "孕晚期身体状态观察待审核草稿",
  "domain": "medical",
  "stage": "pregnancy-late",
  "category": "prenatal-checkup",
  "summary": "孕晚期身体状态观察以复诊问询、体重血压、宫高、胎心、胎位、胎动、胎心监护和超声等为主；发现高危因素、合并症或并发症时应由医疗机构管理、监测、治疗或转诊。",
  "actions": [
    "按医生要求记录胎动，并在复诊时反馈任何明显变化。",
    "复诊时完成体重、血压、宫高、胎心、胎位等检查，并保存相关报告。",
    "按医生安排完成肝功能、肾功能复查，以及胎心监护、超声等建议检查。",
    "如果被纳入高危管理，确认监测频率、复诊地点、转诊要求和紧急联系方式。"
  ],
  "avoid": [
    "不要自行判断胎动减少、胎心监护或超声结果是否安全。",
    "不要忽略医生提示的高危因素或转诊要求。",
    "不要自行决定提前或延后住院分娩。"
  ],
  "askDoctorWhen": [
    "胎动明显异常、阴道出血、破水、规律宫缩、明显头痛、视物异常或检查结果异常时，及时联系医生或就医。",
    "对高危管理、胎心监护、超声、分娩机构选择或住院时机不确定时，向产检医生确认。"
  ],
  "redFlags": [
    "胎动明显异常",
    "阴道出血",
    "破水",
    "规律宫缩",
    "明显头痛或视物异常",
    "检查结果异常"
  ],
  "shoppingType": "not-applicable",
  "fatherTasks": [],
  "sources": [
    "nhc-prenatal-care-2011"
  ],
  "evidenceLevel": "guideline",
  "reviewStatus": "needs-review",
  "updatedAt": "2026-05-08"
}
