{
  "id": "medical-prenatal-checkup-basics",
  "title": "孕期产检的基本定位",
  "domain": "medical",
  "stage": "pregnancy-all",
  "category": "prenatal-checkup",
  "summary": "产检用于建立孕产期保健记录、筛查风险、跟踪孕妇和胎儿情况。具体检查项目和频次应以产检机构、医生评估和当地政策为准。",
  "actions": [
    "确认怀孕后尽早到正规医疗机构建立孕产期保健记录。",
    "把既往病史、用药史、过敏史、既往妊娠史和家族遗传病史整理给医生。",
    "每次产检后保存检查结果和医生建议，便于复诊时核对。"
  ],
  "avoid": [
    "不要用网络清单替代医生给出的个体化产检安排。",
    "不要因为一次检查结果正常就自行跳过后续产检。",
    "不要让本卡片替代检查报告解读或诊断。"
  ],
  "askDoctorWhen": [
    "出现腹痛、阴道出血、明显头痛、视物异常、胎动明显异常或其他不适时，及时联系医生或就医。",
    "有慢性病、高龄妊娠、既往不良妊娠史或检查异常时，按医生建议增加随访。"
  ],
  "redFlags": [
    "阴道出血",
    "持续或加重腹痛",
    "胎动明显减少或消失",
    "严重头痛或视物异常"
  ],
  "shoppingType": "not-applicable",
  "fatherTasks": [
    "陪同建档或重要产检，负责携带证件、既往资料和问题清单。",
    "产检后把医生明确要求的复查时间记录到家庭日历。"
  ],
  "sources": [
    "nhc-prenatal-care-2011",
    "who-antenatal-care-2016"
  ],
  "evidenceLevel": "guideline",
  "reviewStatus": "reviewed",
  "updatedAt": "2026-05-08"
}
