{
  "id": "medical-pregnancy-late-care-notes",
  "title": "孕晚期注意事项待审核草稿",
  "domain": "medical",
  "stage": "pregnancy-late",
  "category": "prenatal-checkup",
  "summary": "孕晚期保健重点包括继续复诊和妊娠图记录，评估胎儿体重、骨盆和分娩方式相关因素，进行必要复查，并接受胎动自我监测、分娩前心理准备、临产先兆、住院分娩、婴儿喂养和新生儿护理指导。",
  "actions": [
    "按医生安排完成孕晚期复诊，携带孕期检查记录和既往报告。",
    "向医生确认胎动自我监测、胎心监护、超声检查、肝肾功能复查等安排。",
    "了解医生对分娩机构选择、分娩方式评估、住院分娩和临产先兆的说明。",
    "记录婴儿喂养、新生儿护理、分娩前心理准备等健康教育内容。"
  ],
  "avoid": [
    "不要自行预测分娩方式或推迟医生建议的孕晚期复查。",
    "不要忽视胎动变化、出血、破水或明显头痛等信号。",
    "不要把分娩计划当作固定方案，临床情况变化时应听从医生或助产士说明。"
  ],
  "askDoctorWhen": [
    "胎动明显异常、阴道出血、破水、规律宫缩、明显头痛或视物异常时，及时联系医生或分娩机构。",
    "对胎心监护、超声检查、住院时机、分娩方式或复查结果不确定时，向产检医生确认。"
  ],
  "redFlags": [
    "胎动明显异常",
    "阴道出血",
    "破水",
    "规律宫缩",
    "明显头痛或视物异常"
  ],
  "shoppingType": "not-applicable",
  "fatherTasks": [],
  "sources": [
    "nhc-prenatal-care-2011",
    "who-antenatal-care-2016"
  ],
  "evidenceLevel": "guideline",
  "reviewStatus": "needs-review",
  "updatedAt": "2026-05-08"
}
