{
  "id": "medical-pregnancy-middle-care-notes",
  "title": "孕中期注意事项待审核草稿",
  "domain": "medical",
  "stage": "pregnancy-middle",
  "category": "prenatal-checkup",
  "summary": "孕中期注意事项包括按初诊或复诊要求持续产检，了解胎动出现时间并记录妊娠图，完成胎儿畸形筛查和其他产前筛查安排，并继续接受营养、心理、卫生、适量运动、贫血预防纠正和口腔问题处理指导。",
  "actions": [
    "按预约完成孕中期产检，并携带既往检查记录和辅助检查结果。",
    "向医生确认胎动出现时间、妊娠图记录和本阶段需要完成的筛查项目。",
    "按医生说明了解16-24周超声筛查胎儿畸形、16-20周唐氏综合征筛查知情选择、24-28周妊娠期糖尿病筛查等安排。",
    "记录医生关于营养、心理、卫生、适量运动、贫血预防纠正和口腔问题处理的建议。",
    "如医生提示高危孕妇或高危胎儿，确认专案管理、监测、治疗、复诊和转诊安排。"
  ],
  "avoid": [
    "不要把产前筛查结果自行解释为诊断结论。",
    "不要跳过医生建议的筛查、复查或转诊。",
    "不要自行处理贫血、血糖异常或口腔问题。",
    "不要把运动、饮食或补充剂安排替代为网络经验方案。"
  ],
  "askDoctorWhen": [
    "对产前筛查、产前诊断、超声检查、血糖筛查、贫血或口腔治疗安排不确定时，咨询产检医生。",
    "出现腹痛、阴道出血、胎动明显异常、明显头痛或视物异常时，及时咨询医生或就医。"
  ],
  "redFlags": [
    "腹痛",
    "阴道出血",
    "胎动明显异常",
    "明显头痛或视物异常"
  ],
  "shoppingType": "not-applicable",
  "fatherTasks": [],
  "sources": [
    "nhc-prenatal-care-2011",
    "who-antenatal-care-2016"
  ],
  "evidenceLevel": "guideline",
  "reviewStatus": "reviewed",
  "updatedAt": "2026-05-08"
}
