{
  "id": "early-education-prenatal-reading-singing-boundaries",
  "title": "孕期读书唱歌和胎儿熟悉声音的边界",
  "domain": "early-education",
  "stage": "pregnancy-all",
  "category": "early-education",
  "summary": "孕期读书、唱歌和轻柔说话适合定位为亲子联结和让宝宝熟悉照护者声音，而不是胎儿能力训练。已登记来源支持的边界是：胎儿在孕中晚期逐步能听到部分声音，熟悉的声音出生后可能带来安抚；但不能把出生前读唱写成能提升智力、语言、性格、音乐能力或学习成绩。",
  "actions": [
    "把读书、唱歌、轻柔说话安排成照护者自己也放松的日常互动，例如睡前几分钟读一段短文或唱一首熟悉的歌。",
    "用自然音量和舒适姿势进行，不需要贴近肚子大声播放，也不需要固定复杂课程表。",
    "可以让伴侣或主要照护者轮流说话、读短句或唱熟悉歌曲，把重点放在家庭联结和照护者的稳定陪伴。",
    "如果当天疲劳、紧张或不想读唱，可以暂停；孕期亲子联结不靠单一任务完成，也不需要因为没有坚持而自责。",
    "出生后继续把阅读和唱歌作为亲子相处时间，观察宝宝对声音、目光和安抚方式的反应。"
  ],
  "avoid": [
    "不要声称胎教能提升智力、语言能力、性格、专注力、音乐能力或学习成绩。",
    "不要把孕期读书、唱歌包装成胎儿课程、训练计划、打卡任务或出生前教学。",
    "不要为了让胎儿听见而长时间播放过响的声音，或让孕妇在不舒服、焦虑时硬撑完成所谓早教任务。",
    "不要购买或推荐课程、机构、App、胎教设备、玩具或教具品牌。",
    "不要把孕期不适、胎动明显变化或其他异常解释为胎教反应。"
  ],
  "askDoctorWhen": [
    "孕期出现腹痛、阴道出血、胎动明显减少或明显异常、发热、头痛视物异常等情况时，应及时联系产科医生或就医，不要把这些情况当作早教问题处理。",
    "新生儿听力筛查未通过，或出生后照护者怀疑宝宝对声音反应异常时，应按医生或儿童保健机构建议复查和随访。",
    "如果孕期长期焦虑、睡眠严重受影响，或亲子联结困难让照护者明显痛苦，可以向产科医生、助产士或心理专业人员寻求帮助。"
  ],
  "redFlags": [
    "胎动明显减少或明显异常",
    "腹痛或阴道出血",
    "新生儿听力筛查未通过",
    "宝宝出生后对声音反应异常"
  ],
  "shoppingType": "not-applicable",
  "fatherTasks": [],
  "sources": [
    "healthychildren-unborn-hearing-reading-singing",
    "nhs-start-for-life-prenatal-bonding"
  ],
  "evidenceLevel": "public-health-guidance",
  "reviewStatus": "needs-review",
  "updatedAt": "2026-05-08"
}
