{
  "id": "medical-pregnancy-early-diet-structure",
  "title": "孕早期膳食结构待审核草稿",
  "domain": "medical",
  "stage": "pregnancy-early",
  "category": "feeding",
  "summary": "孕早期膳食结构应以平衡膳食为基础，关注孕期体重适宜增长、含铁食物、碘盐、叶酸和维生素D补充边界；孕吐严重时可少量多餐，并保证摄入含必需量碳水化合物的食物。本卡为图片来源整理的待审核草稿，不替代医生或营养专业人员的个体化建议。",
  "actions": [
    "按平衡膳食宝塔思路安排食物组：谷类和薯类、蔬菜、水果、鱼禽蛋肉、奶类、大豆和坚果，并注意烹调油、盐和饮水。",
    "常吃含铁丰富的食物，日常用盐优先选用碘盐；叶酸和维生素D补充按医生或营养专业人员建议执行。",
    "孕吐明显时可采用少量多餐，把重点放在能入口、能维持能量和必需碳水化合物摄入的食物上。",
    "记录体重变化和饮食困难，在产检时向医生反馈。"
  ],
  "avoid": [
    "不要把本卡当作具体食谱、营养素剂量或补充剂处方。",
    "不要因孕吐自行长期只吃单一食物，无法进食或饮水时不要硬扛。",
    "不要把网络经验、商品宣传或个人饮食偏好写成医学建议。",
    "不要替代医生或营养专业人员处理妊娠剧吐、贫血、糖尿病等情况。"
  ],
  "askDoctorWhen": [
    "持续呕吐不能进食、体重明显下降、贫血、血糖异常、基础疾病或需要营养补充剂时，咨询医生或营养专业人员。",
    "对饮食禁忌、补充剂、用药或检查结果不确定时，向产检医生确认。"
  ],
  "redFlags": [
    "持续呕吐不能进食",
    "体重明显下降",
    "贫血",
    "血糖异常"
  ],
  "shoppingType": "not-applicable",
  "fatherTasks": [],
  "sources": [
    "cns-pregnant-lactating-dietary-guidelines-2022",
    "who-antenatal-care-2016"
  ],
  "evidenceLevel": "guideline",
  "reviewStatus": "needs-review",
  "updatedAt": "2026-05-08"
}
