{
  "id": "early-education-preschool-scientific-care-anti-early-academics",
  "title": "3-6 岁科学保教和反超前教育",
  "domain": "early-education",
  "stage": "preschool-3-6y",
  "category": "development",
  "summary": "3-6 岁科学保教应尊重幼儿学习与发展的规律，把家庭生活、游戏、阅读、表达、探索和同伴交往作为主要支持方式。教育部《3-6岁儿童学习与发展指南》明确强调提高科学保教水平，并在幼小衔接中要求严禁幼儿园提前学习小学教育内容，不能用入学选拔、刷题或单一学科指标评价幼儿。",
  "actions": [
    "把每天的生活自理、户外活动、共读、讲述经历、观察自然和合作游戏作为主要学习机会。",
    "围绕孩子感兴趣的问题进行开放式对话，例如你看到了什么、你觉得为什么、还可以怎么试，而不是直接要求标准答案。",
    "给孩子安排画画、搭建、角色扮演、音乐律动、简单家务和同伴游戏，支持表达、想象、规则意识和合作。",
    "用清楚稳定的家庭规则支持行为发展，例如等待轮流、用语言表达需要、收拾自己的物品。",
    "做幼小衔接时重点支持作息、生活自理、倾听表达、交往和安全习惯，而不是提前学习小学课程。"
  ],
  "avoid": [
    "不要提前教授小学课程内容，或用识字量、计算速度、刷题成绩作为 3-6 岁发展的核心目标。",
    "不要参加或制造入学选拔式训练、机械识字、长时间书写、刷题或强化训练。",
    "不要用单一指标评价孩子，也不要把孩子之间的进度差异简单归为懒、笨或不努力。",
    "不要用课程、机构、App、玩具或教具品牌替代家庭日常互动和游戏经验。",
    "不要把教育建议当作发育评估、医学诊断、心理评估或特殊教育判断。"
  ],
  "askDoctorWhen": [
    "如果照护者担心孩子语言、听力、动作、社交互动、情绪行为或生活自理发展明显落后，应咨询儿科医生、儿童保健机构或专业人员。",
    "如果孩子出现能力退化、持续攻击或自伤行为、严重睡眠或进食问题，应尽快寻求专业帮助。",
    "如果幼儿园或家庭观察到明显安全风险、行为严重异常或疑似特殊教育需要，应寻求儿童保健、心理或教育专业人员评估。"
  ],
  "redFlags": [
    "语言、社交、动作或生活自理能力明显退化",
    "照护者怀疑听力或视力异常",
    "持续攻击、自伤或严重行为异常",
    "严重睡眠、进食或安全风险"
  ],
  "shoppingType": "not-applicable",
  "fatherTasks": [],
  "sources": [
    "moe-3-6-learning-development-guidelines",
    "cdc-essentials-parenting-toddlers-preschoolers"
  ],
  "evidenceLevel": "guideline",
  "reviewStatus": "needs-review",
  "updatedAt": "2026-05-08"
}
