{
  "id": "medical-pregnancy-early-body-status",
  "title": "孕早期身体状态观察待审核草稿",
  "domain": "medical",
  "stage": "pregnancy-early",
  "category": "prenatal-checkup",
  "summary": "孕早期身体状态观察应围绕初诊信息采集、身高体重血压、全身体格检查、盆腔检查及基础辅助检查展开；是否正常、是否高危应由医生结合检查结果判断。",
  "actions": [
    "记录孕早期出现的腹痛、出血、发热、呕吐、头痛、视物异常等情况，并在产检时主动告知医生。",
    "按医生安排完成身高、体重、血压、全身体格检查和孕早期盆腔检查。",
    "保留血常规、血型、尿常规、肝肾功能、感染筛查等检查结果，复诊时带齐。",
    "如果医生提示危险因素或高危管理，确认随访频率、复查项目和转诊地点。"
  ],
  "avoid": [
    "不要把身体不适自行归因于正常早孕反应而延误咨询。",
    "不要自行判读化验单是否正常。",
    "不要因为没有明显不适就跳过建册或初诊检查。"
  ],
  "askDoctorWhen": [
    "腹痛、阴道出血、发热、持续呕吐不能进食、明显头痛或视物异常出现时，及时咨询医生或就医。",
    "检查结果异常、医生提示高危因素、需要会诊或转诊时，按医生要求复诊或转诊。"
  ],
  "redFlags": [
    "腹痛",
    "阴道出血",
    "发热",
    "持续呕吐不能进食",
    "明显头痛或视物异常"
  ],
  "shoppingType": "not-applicable",
  "fatherTasks": [],
  "sources": [
    "nhc-prenatal-care-2011"
  ],
  "evidenceLevel": "guideline",
  "reviewStatus": "needs-review",
  "updatedAt": "2026-05-08"
}
