{
  "id": "medical-pregnancy-middle-body-status",
  "title": "孕中期身体状态观察待审核草稿",
  "domain": "medical",
  "stage": "pregnancy-middle",
  "category": "prenatal-checkup",
  "summary": "孕中期指妊娠13-27+6周，身体状态观察重点是复诊问询、体重血压、宫高、胎心、胎位、胎动出现时间、妊娠图记录和筛查结果。胎动、胎心、宫高或筛查异常都不能自行解释，应由医疗机构评估和处理。",
  "actions": [
    "复诊时主动告知近期健康状况、胎动出现时间、腹痛出血等不适，以及体重、血压或其他检查变化。",
    "按医生安排完成体重、血压、宫高、胎心、胎位等产科检查。",
    "保存每次血常规、尿常规、妊娠图、超声筛查和其他筛查结果，按医生要求复诊。",
    "向医生确认16-24周胎儿畸形超声筛查、16-20周唐氏综合征筛查知情选择和24-28周妊娠期糖尿病筛查安排。",
    "如果医生提示胎儿畸形筛查异常、高危胎儿或需要产前诊断，及时转到有资质的医疗保健机构。"
  ],
  "avoid": [
    "不要自行判断胎动、胎心、宫高或筛查结果是否正常。",
    "不要拖延医生建议的产前诊断或转诊。",
    "不要因自觉状态稳定而减少复诊。",
    "不要把产前筛查结果当作最终诊断结论。"
  ],
  "askDoctorWhen": [
    "胎动明显异常、腹痛、阴道出血、明显头痛、视物异常或检查结果异常时，及时咨询医生或就医。",
    "被提示高危孕妇或高危胎儿时，确认专案管理、监测、治疗或转诊安排。"
  ],
  "redFlags": [
    "胎动明显异常",
    "腹痛",
    "阴道出血",
    "明显头痛或视物异常",
    "检查结果异常"
  ],
  "shoppingType": "not-applicable",
  "fatherTasks": [],
  "sources": [
    "nhc-prenatal-care-2011"
  ],
  "evidenceLevel": "guideline",
  "reviewStatus": "needs-review",
  "updatedAt": "2026-05-08"
}
