{
  "id": "father-tasks-pregnancy-late-support",
  "title": "孕晚期爸爸任务清单",
  "domain": "father-tasks",
  "stage": "pregnancy-late",
  "category": "father-prenatal",
  "summary": "孕晚期爸爸的重点是把分娩前准备具体化：一起完成待产包、分娩计划、去医院路线、宝宝安全座椅和早期用品；同时继续关注胎动变化、孕妇休息、对分娩的担心，并在临产或异常信号出现时承担联系和后勤支持。",
  "actions": [
    "和孕妇一起确认分娩计划、待产包、证件资料、交通路线、停车方式、备用联系人和产科机构联系方式。",
    "参加或复习产前课程内容，了解临产征象、宫缩、疼痛缓解选择、分娩后流程等信息，用于现场支持和提问。",
    "协助孕妇获得休息，承担搬重物、采购、清洁、跑腿等体力任务，并一起讨论对分娩的担心。",
    "准备宝宝安全座椅和出生后早期必需用品，但不囤积未经确认或存在安全争议的产品。",
    "临近预产期保持手机畅通，准备陪产者个人用品，包括充电器、简单食物、饮水、换洗衣物和必要证件。",
    "分娩现场按照孕妇意愿提供情绪和身体支持，帮助表达需求、递水和食物、换姿势、记录医生或助产士说明。"
  ],
  "avoid": [
    "不要临近预产期才准备路线、待产包、证件和联系方式。",
    "不要把分娩计划当作不能调整的固定方案，临床情况变化时应听取医生或助产士说明。",
    "不要在分娩现场替孕妇或医务人员做医学判断。",
    "不要忽视胎动减少、破水、出血、规律宫缩或孕妇明显不适。"
  ],
  "askDoctorWhen": [
    "出现阴道出血、胎动明显减少或停止、规律宫缩、破水、明显头痛或视物异常时，按医生或分娩机构指导及时联系或就医。",
    "对分娩方式、胎心监护、超声检查、住院时机、疼痛缓解方式或是否需要剖宫产不确定时，向医生或助产士确认。"
  ],
  "redFlags": [
    "阴道出血",
    "胎动明显减少或停止",
    "破水",
    "规律宫缩",
    "明显头痛或视物异常"
  ],
  "shoppingType": "not-applicable",
  "fatherTasks": [
    "共同确认分娩计划、待产包、证件和产科机构联系方式。",
    "提前熟悉医院路线、停车和备用交通方案。",
    "准备宝宝安全座椅和出生后早期必需用品。",
    "承担搬重物、采购、清洁和跑腿等体力任务。",
    "保持手机畅通并准备陪产者个人用品。",
    "分娩现场协助沟通、补水、换姿势和记录医生说明。",
    "胎动减少、破水、出血或规律宫缩时协助联系产科机构。"
  ],
  "sources": [
    "nhc-prenatal-care-2011",
    "nhs-advice-for-partners-pregnancy",
    "tommys-getting-involved-pregnancy",
    "nhs-birth-partner-tips",
    "tommys-dads-partners-birth-prep"
  ],
  "evidenceLevel": "public-health-guidance",
  "reviewStatus": "needs-review",
  "updatedAt": "2026-05-08"
}
